{"$id":"https://locus.invalid/schemas/managed-performance-methodology-v2.schema.json","$schema":"https://json-schema.org/draft/2020-12/schema","additionalProperties":false,"properties":{"arms":{"maxItems":4,"minItems":4,"type":"array"},"blocking_and_randomization":{"type":"object"},"decision_id":{"const":"D030"},"deployment":{"type":"object"},"failure_schedules":{"type":"object"},"format_id":{"const":"LOCUS-managed-performance-methodology-v2"},"limitations":{"type":"array"},"metrics":{"type":"object"},"resumption":{"type":"object"},"retention_gate":{"type":"object"},"sample_plan":{"type":"object"},"statistics":{"type":"object"},"status":{"const":"approved-preparation-only"}},"required":["format_id","decision_id","status","deployment","arms","blocking_and_randomization","sample_plan","failure_schedules","metrics","statistics","resumption","retention_gate","limitations"],"type":"object"}
